{
  "flight_ids": [
    "ebb63d351dccbac8",
    "e0d5de55bc6f39fb",
    "0e8784425c25c656",
    "c355c8f176ece094",
    "f98a62808a81935a",
    "afa3994b502aa2d1",
    "584e022a47517397",
    "d9cf4cb3ad16129e",
    "c3e1129443d78b39",
    "9c371069cd31b889",
    "2ecf6193fb4bba2f",
    "39d4610e6a691915",
    "df3c2e9ffe08091e",
    "c924536e435145ed",
    "a603d96498fb1db0",
    "076889019f6a405b",
    "bd03e79c9a3aa5c1",
    "5c45821c81da250e",
    "5b686ab1daabc3f5",
    "2b2945dbdee75885",
    "f2e63159ec0d6632",
    "90132d8dd417225c",
    "0c530710a1c60e1c",
    "8cf33695e94227bf",
    "abbcb5dde18f399f",
    "68d91c240953f50f",
    "6ab567cc2f46e677",
    "eefe8c71499d54b9",
    "f6ac8353a8589aa4",
    "62843b1a45406ade",
    "f52342eb6fc37071",
    "3e6575a23df359a6",
    "3c8493c674d56815",
    "6509deccbb08e9f5",
    "52ed07baad5f7668",
    "4b0d94be7f9a9f86",
    "54b85ee48c519d3f"
  ],
  "runs": [
    {
      "flight_id": "ebb63d351dccbac8",
      "classification": "GROUND_START",
      "phase": "PRE_START",
      "phase_uncertain": false,
      "start_utc": "2026-04-08T14:18:13",
      "end_utc": "2026-04-08T14:18:53",
      "duration_s": 41.0,
      "co_alerts": [
        "EFIS ON BKUP",
        "NAV ON BKUP",
        "FUEL PRESS",
        "RAGL FAIL",
        "TRAFFIC FAIL"
      ],
      "lane_check_pair": false,
      "lane_check_note": "",
      "context": {
        "mean_rpm": 0.0,
        "mean_power_pct": null,
        "mean_oil_press_psi": null,
        "mean_oil_temp_f": null,
        "mean_coolant_temp_f": null,
        "mean_main_volts": 13.0,
        "mean_batt_amps": -2.1707317073170733,
        "mean_fuel_press_psi": 0.2902439024390244,
        "mean_ias_kt": 16.726829268292683,
        "mean_baro_alt_ft": 133.0731707317073,
        "oil_nan_frac": 1.0
      }
    },
    {
      "flight_id": "ebb63d351dccbac8",
      "classification": "GROUND_START",
      "phase": "PRE_START",
      "phase_uncertain": false,
      "start_utc": "2026-04-08T14:19:15",
      "end_utc": "2026-04-08T14:19:35",
      "duration_s": 21.0,
      "co_alerts": [
        "OIL PRESS",
        "EFIS ON BKUP",
        "NAV ON BKUP",
        "RAGL FAIL",
        "TRAFFIC FAIL",
        "FUEL PRESS"
      ],
      "lane_check_pair": false,
      "lane_check_note": "",
      "context": {
        "mean_rpm": 0.0,
        "mean_power_pct": null,
        "mean_oil_press_psi": 0.0,
        "mean_oil_temp_f": 92.0,
        "mean_coolant_temp_f": 93.0,
        "mean_main_volts": 12.895238095238096,
        "mean_batt_amps": -3.380952380952381,
        "mean_fuel_press_psi": 4.328571428571429,
        "mean_ias_kt": 17.380952380952383,
        "mean_baro_alt_ft": 132.76190476190476,
        "oil_nan_frac": 0.9523809523809523
      }
    },
    {
      "flight_id": "ebb63d351dccbac8",
      "classification": "LANE_CHECK",
      "phase": "TAXI",
      "phase_uncertain": false,
      "start_utc": "2026-04-08T14:31:43",
      "end_utc": "2026-04-08T14:31:46",
      "duration_s": 4.0,
      "co_alerts": [],
      "lane_check_pair": true,
      "lane_check_note": "paired",
      "context": {
        "mean_rpm": 4167.5,
        "mean_power_pct": 34.75,
        "mean_oil_press_psi": 57.0,
        "mean_oil_temp_f": 166.0,
        "mean_coolant_temp_f": 174.0,
        "mean_main_volts": 13.4,
        "mean_batt_amps": 9.0,
        "mean_fuel_press_psi": 45.95,
        "mean_ias_kt": 18.275,
        "mean_baro_alt_ft": 99.5,
        "oil_nan_frac": 0.0
      }
    },
    {
      "flight_id": "ebb63d351dccbac8",
      "classification": "LANE_CHECK",
      "phase": "TAXI",
      "phase_uncertain": false,
      "start_utc": "2026-04-08T14:31:54",
      "end_utc": "2026-04-08T14:32:00",
      "duration_s": 7.0,
      "co_alerts": [],
      "lane_check_pair": true,
      "lane_check_note": "paired",
      "context": {
        "mean_rpm": 4071.4285714285716,
        "mean_power_pct": 33.714285714285715,
        "mean_oil_press_psi": 56.5,
        "mean_oil_temp_f": 166.0,
        "mean_coolant_temp_f": 173.85714285714286,
        "mean_main_volts": 13.400000000000002,
        "mean_batt_amps": 9.0,
        "mean_fuel_press_psi": 45.89999999999999,
        "mean_ias_kt": 18.2,
        "mean_baro_alt_ft": 99.57142857142857,
        "oil_nan_frac": 0.7142857142857143
      }
    },
    {
      "flight_id": "ebb63d351dccbac8",
      "classification": "GROUND_SHUTDOWN",
      "phase": "SHUTDOWN",
      "phase_uncertain": false,
      "start_utc": "2026-04-08T15:09:05",
      "end_utc": "2026-04-08T15:09:37",
      "duration_s": 33.0,
      "co_alerts": [
        "EFIS ON BKUP",
        "NAV ON BKUP",
        "RAGL FAIL",
        "FUEL PRESS",
        "ALT FAIL"
      ],
      "lane_check_pair": false,
      "lane_check_note": "",
      "context": {
        "mean_rpm": 160.9090909090909,
        "mean_power_pct": null,
        "mean_oil_press_psi": 45.0,
        "mean_oil_temp_f": 177.0,
        "mean_coolant_temp_f": 179.0,
        "mean_main_volts": 7.087878787878789,
        "mean_batt_amps": 0.2727272727272727,
        "mean_fuel_press_psi": 5.578787878787878,
        "mean_ias_kt": 15.018181818181818,
        "mean_baro_alt_ft": 165.6969696969697,
        "oil_nan_frac": 0.9090909090909091
      }
    },
    {
      "flight_id": "e0d5de55bc6f39fb",
      "classification": "GROUND_START",
      "phase": "PRE_START",
      "phase_uncertain": false,
      "start_utc": "2026-04-09T12:51:01",
      "end_utc": "2026-04-09T12:51:20",
      "duration_s": 20.0,
      "co_alerts": [
        "EFIS ON BKUP",
        "NAV ON BKUP",
        "ALT FAIL",
        "FUEL PRESS",
        "RAGL FAIL",
        "TRAFFIC FAIL"
      ],
      "lane_check_pair": false,
      "lane_check_note": "",
      "context": {
        "mean_rpm": 0.0,
        "mean_power_pct": null,
        "mean_oil_press_psi": 0.0,
        "mean_oil_temp_f": null,
        "mean_coolant_temp_f": null,
        "mean_main_volts": 1.1099999999999999,
        "mean_batt_amps": -0.55,
        "mean_fuel_press_psi": 1.1600000000000001,
        "mean_ias_kt": 13.654999999999998,
        "mean_baro_alt_ft": 116.0,
        "oil_nan_frac": 0.95
      }
    },
    {
      "flight_id": "e0d5de55bc6f39fb",
      "classification": "GROUND_START",
      "phase": "PRE_START",
      "phase_uncertain": false,
      "start_utc": "2026-04-09T12:51:34",
      "end_utc": "2026-04-09T12:52:05",
      "duration_s": 32.0,
      "co_alerts": [
        "OIL PRESS",
        "EFIS ON BKUP",
        "NAV ON BKUP",
        "RAGL FAIL",
        "TRAFFIC FAIL",
        "FUEL PRESS"
      ],
      "lane_check_pair": false,
      "lane_check_note": "",
      "context": {
        "mean_rpm": 12.1875,
        "mean_power_pct": null,
        "mean_oil_press_psi": 1.0,
        "mean_oil_temp_f": 70.0,
        "mean_coolant_temp_f": 70.0,
        "mean_main_volts": 13.09375,
        "mean_batt_amps": -3.125,
        "mean_fuel_press_psi": 3.48125,
        "mean_ias_kt": 13.337500000000002,
        "mean_baro_alt_ft": 115.21875,
        "oil_nan_frac": 0.96875
      }
    },
    {
      "flight_id": "e0d5de55bc6f39fb",
      "classification": "GROUND_SHUTDOWN",
      "phase": "SHUTDOWN",
      "phase_uncertain": false,
      "start_utc": "2026-04-09T13:15:49",
      "end_utc": "2026-04-09T13:16:28",
      "duration_s": 40.0,
      "co_alerts": [
        "EFIS ON BKUP",
        "NAV ON BKUP",
        "ALT FAIL",
        "FUEL PRESS",
        "RAGL FAIL"
      ],
      "lane_check_pair": false,
      "lane_check_note": "",
      "context": {
        "mean_rpm": 91.5,
        "mean_power_pct": null,
        "mean_oil_press_psi": 46.0,
        "mean_oil_temp_f": 164.0,
        "mean_coolant_temp_f": 171.0,
        "mean_main_volts": 0.5425000000000001,
        "mean_batt_amps": 7.625,
        "mean_fuel_press_psi": 1.8000000000000003,
        "mean_ias_kt": 13.030000000000001,
        "mean_baro_alt_ft": 126.85,
        "oil_nan_frac": 0.975
      }
    },
    {
      "flight_id": "0e8784425c25c656",
      "classification": "GROUND_START",
      "phase": "PRE_START",
      "phase_uncertain": false,
      "start_utc": "2026-04-17T11:25:29",
      "end_utc": "2026-04-17T11:25:31",
      "duration_s": 3.0,
      "co_alerts": [
        "EFIS ON BKUP",
        "NAV ON BKUP",
        "FUEL PRESS",
        "CO PPM",
        "RAGL FAIL"
      ],
      "lane_check_pair": false,
      "lane_check_note": "",
      "context": {
        "mean_rpm": 0.0,
        "mean_power_pct": 0.0,
        "mean_oil_press_psi": null,
        "mean_oil_temp_f": null,
        "mean_coolant_temp_f": null,
        "mean_main_volts": 13.0,
        "mean_batt_amps": -0.6666666666666666,
        "mean_fuel_press_psi": -0.3,
        "mean_ias_kt": 14.133333333333333,
        "mean_baro_alt_ft": 68.0,
        "oil_nan_frac": 1.0
      }
    },
    {
      "flight_id": "0e8784425c25c656",
      "classification": "GROUND_START",
      "phase": "PRE_START",
      "phase_uncertain": false,
      "start_utc": "2026-04-17T11:25:54",
      "end_utc": "2026-04-17T11:27:36",
      "duration_s": 103.0,
      "co_alerts": [
        "EFIS ON BKUP",
        "NAV ON BKUP",
        "CO PPM",
        "RAGL FAIL",
        "TRAFFIC FAIL",
        "FUEL PRESS",
        "ALT FAIL"
      ],
      "lane_check_pair": false,
      "lane_check_note": "",
      "context": {
        "mean_rpm": 5.242718446601942,
        "mean_power_pct": null,
        "mean_oil_press_psi": 0.0,
        "mean_oil_temp_f": 72.0,
        "mean_coolant_temp_f": 72.0,
        "mean_main_volts": 12.713592233009718,
        "mean_batt_amps": -2.9902912621359223,
        "mean_fuel_press_psi": 2.848543689320388,
        "mean_ias_kt": 13.675728155339804,
        "mean_baro_alt_ft": 68.02912621359224,
        "oil_nan_frac": 0.9902912621359223
      }
    },
    {
      "flight_id": "0e8784425c25c656",
      "classification": "LANE_CHECK",
      "phase": "TAXI",
      "phase_uncertain": false,